{
  "contractVersion": "command@0.1.0",
  "schemaId": "command",
  "schemaVersion": 1,
  "commandId": "command.runtime.open-main-door",
  "commandType": "core.set-value",
  "initiator": {
    "kind": "system"
  },
  "idempotencyKey": "idempotency.main-door",
  "targets": [
    {
      "id": "device.example.main-door",
      "entityType": "device"
    }
  ],
  "payload": {
    "value": "open"
  }
}
