{
  "contractVersion": "command@0.1.0",
  "schemaId": "command",
  "schemaVersion": 1,
  "commandType": "core.set-value",
  "initiator": {
    "kind": "system"
  },
  "targets": [
    {
      "id": "device.example.main-door",
      "entityType": "device"
    }
  ],
  "preconditions": [
    {
      "contractVersion": "condition@0.1.0",
      "schemaId": "condition",
      "schemaVersion": 1,
      "type": "condition-ref",
      "conditionId": "condition.core.allow-command"
    }
  ],
  "payload": {
    "value": "open"
  }
}
